,rank,itemName,itemPrice,itemCaption,itemUrl,genreId
11,12,ザバス ホエイプロテイン100 ココア(1.05kg)【sav03】【2shdrk】【ザバス(SAVAS)】,3980,お店TOP＞ザバス ホエイプロテイン100 ココア (1.05kg)お一人様1個まで。【ザバス ホエイプロテイン100 ココアの商品詳細】●理想的なカラダづくりに取り組む方のために、体内での利用効率の高いホエイプロテインを使用●カラダづくりに必要なビタミン配合●おいしく溶けやすい！●約50食分(1食分21g*50)●ココア味【召し上がり方】・水または牛乳200mlに付属のスプーン3杯(約21g)を溶かす。目安：1日2回※水または牛乳に溶かした後は、速やかにお飲みください。※溶かす量は、お好みに応じて調整して下さい。・プロテインシェイカーは別売りです。【品名・名称】プロテインパウダー(粉末たんぱく食品)【ザバス ホエイプロテイン100 ココアの原材料】乳清たんぱく、ココアパウダー、植物油脂、デキストリン、食塩／乳化剤、香料、V.C、増粘剤(プルラン)、甘味料(スクラロース、アセスルファムK)、V.B2、V.B6、V.B1、ナイアシン、V.D、(一部に乳成分、大豆を含む)【栄養成分】(1食分(21g)当たり)エネルギー：83kcal、たんぱく質：15.0g、脂質：1.4g、炭水化物：2.5g、食塩相当量：0.14-0.43g、ナイアシン：3.6mg-9.9mg、ビタミンB1：0.50mg、ビタミンB2：0.57mg、ビタミンB6：0.42mg、ビタミンC：32mg、ビタミンD：9.1μg・タンパク含量75％(製品無水物あたり)・アミノ酸スコア100【アレルギー物質】乳成分、大豆【保存方法】直射日光及び高温多湿の場所を避けて保存してください。【注意事項】・あけくちや袋のはしで手を切るなどのケガをしないようご注意ください。・お湯または温かい牛乳をシェイカーに入れてシェイクしないでください。水蒸気や内容液が吹き出し、やけどの原因になります。・体質や健康状態によっては身体に合わないことがあります。その場合は摂取を中止し、医師や専門家にご相談ください。・開封後はホコリや髪の毛が入らないようチャックをしっかりとしめ、温度や湿度の高い場所を避けて保管し、なるべく早めにお召し上がりください。・濡れたスプーンを袋の中に入れないでください。・製品中に色の黒い粒が見えることがあります、これは原材料の一部で品質には問題ありません。【原産国】日本【ブランド】ザバス(SAVAS)【発売元、製造元、輸入元又は販売元】明治商品に関するお問い合わせは、下記までお願いいたします。受付時間：9：00-17：00(土日祝、年末年始除く)おかし：0120-041-082一般食品：0120-370-369ベビー：0120-358-369栄養食品・流動食(メイバランス他)：0120-201-369スポーツ(ヴァーム他)・美容・健康：0120-858-660リニューアルに伴い、パッケージ・内容等予告なく変更する場合がございます。予めご了承ください。(SAVAS ザヴァス ホエープロテイン100 ココア味 1050g 　プロテイン ザバス)/(/F277003/F237102/F213106/F213106/)/明治東京都中央区京橋2-2-1 ※お問合せ番号は商品詳細参照広告文責：楽天グループ株式会社電話：050-5306-1825[プロテイン/ブランド：ザバス(SAVAS)/]&nbsp;,https://item.rakuten.co.jp/soukaidrink/4902777323176/,567617
12,13,【VT公式】楽天上半期ベストコスメ【CICAデイリースージングマスク (30枚入り) 】シートマスク マスクパック デイリーマスク シカ CICA 鎮静 潤い スキンケア コスメ 保湿 大容量 シートマスク 韓国コスメ 自宅エステ おうち美容 シカパック_AD_SS,1936,"商品情報 製品名 VTシカデイリースージングマスク VT CICA DAILY SOOTHING MASK 商品説明 乾燥して疲れた肌にうるおいを届けて肌を鎮静するデイリースペシャルマスク。 濃密なうるおいで一日一回　うるおい補給＋鎮静ケア＋エネルギーチャージ 簡単にスキンケアできる大容量デイリーマスクで、朝・夜に簡単にケア！ VT独自成分を配合して水分&鎮静ケア、油・水分バランスを整えて穏やかな肌へ。 ブランド VT cosmetics 原産国 韓国 商品区分 化粧品 容量 30枚 使用期間 開封前：24ヶ月　個包装開封後：12ヶ月 使用方法 1．洗顔後、化粧水で肌をととのえます。 2．フタを開けてミニピンセットで一枚を取り出します。 3．顔に均一に密着させ、10−15分後にとって 　残りの美容液はやさしくタッピングしてなじませます。 製品使用上注意事項 1.お肌に異常が生じていないかよく注意して使用してください。化粧品がお肌に合わないとき即ち次のような場合には、使用を中止してください。そのまま使用を続けますと、症状を悪化させることがありますので、皮膚科専門医等にご相談されることをおすすめします。 (1)使用中、赤味、はれ、かゆみ、刺激、色抜け(白斑等)や黒ずみ等の異常があらわれた場合 (2)使用したお肌に、直射日光があたって上記のような異常があらわれた場合 2.傷やはれもの、しっしん等、異常のある部位にはお使いにならないでください。 3.目に入った時は、直ちに洗い流してください。 4.保管及び取扱い上の注意 (1)開封後はお早めにご使用ください。 (2)乳幼児の手の届かないところに保管してください。 (3)高温又は低温の場所、直射日光のあたる場所には保管しないでください。 キーワード シートマスク マスクパック スキンケア 化粧水 シカ 鎮静 水分 うるおい しっとり ツヤ ツヤ肌 角質 皮脂 ケア 肌キメ　毛穴 引き締め バランスケア ツルツル 乾燥肌 敏感肌 低刺激 おこもり美容 化粧品 コスメ 韓国コスメ デイリーマスク シカ 鎮静 潤いスキンケア パック シートマスク フェイスパック フェイスマスク コスメ 保湿 大容量 韓国コスメ 化粧水 自宅エステ おうち美容 vt コスメ vt シカ cica 全成分 水、グリセリン、DPG、1,2-ヘキサンジオール、カプリン酸ポリグリセリル-4、 プロパンジオール、カプリリルグリコール、ダイウイキョウ果実エキス、トレハロース、 グレープフルーツ種子エキス、ヒアルロン酸Na、アルギニン、パンテノール、 エチルヘキシルグリセリン、ツボクサエキス、マデカッソシド、マデカシン酸、 アシアチコシド、アシアチン酸、プロポリスエキス、カルボマー、キサンタンガム、 EDTA-2Na、グリチルリチン酸2K、BG、ハチミツエキス、スベリヒユエキス、 ローヤルゼリーエキス、カミツレ花エキス、フルクタン、キシリチルグルコシド、 無水キシリトール、キシリトール、グルコース、グリシン、セリン、グルタミン酸、 アスパラギン酸、ロイシン、アラニン、リシン、アルギニン、チロシン、フェニルアラニン、 トレオニン、プロリン、バリン、イソロイシン、ヒスチジン、メチオニン、システイン、 香料 広告文責 VT Cosmetics, 23, Samseong-ro 76-gil, Gangnam-gu, Seoul, Republic of Korea 827049156580 販売元 株式会社　VT Japan 注意事項 ・当店でご購入された商品は、原則として、「個人輸入」としての取り扱いになり、韓国のソウルからお客様のもとへ直送されます。 ・個人輸入される商品は、全てご注文者自身の「個人使用・個人消費」が前提となりますので、ご注文された商品を第三者へ譲渡・転売することは法律で禁止されております。 ・関税・消費税が課税される場合があります。詳細はこちらにご確認下さい。",https://item.rakuten.co.jp/vtcosmetic-official/p00000dq/,503020
13,14,【クーポン利用で2箱15％OFF】炭酸水 500ml 24本 送料無料 強炭酸 無糖 ZAO SODA プレーン レモン ライフドリンクカンパニー LDC 割り材 まとめ買い 箱買い 48本で割引あり,1598,名峰・蔵王連峰山麓の地下水を使用した、強炭酸水です。 おいしい水を、すっきりさわやかで爽快な飲み心地に仕上げました。 健康的な毎日の飲み物として、ハイボールやソーダ割りなどの割り材として、さまざまな用途にお使い頂けます。 500ml（ミリリットル）24本入り1ケースの販売ページです。 全国送料無料でお届けします。 ※1箱単位での配送となります。2箱(48本)以上のご注文の場合は伝票番号も個口分、発行されますので再配達依頼の際はご注意ください。 予めご了承いただきますようお願いいたします。 名称 炭酸飲料 原材料名 水／炭酸、香料（レモンのみ） 内容量 ペットボトル（500ml）×24本 賞味期限 製造後6か月（キャップに記載） 保存方法 直射日光、高温を避けて保存してください。 製造者 株式会社ライフドリンクカンパニー大阪府大阪市北区梅田3-3-10 製造工場 株式会社ライフドリンクカンパニー蔵王工場 栄養成分 エネルギー　0kcal ／ たんぱく質　0g脂質　0g ／ 炭水化物　0g ／ 食塩相当量　0.01g,https://item.rakuten.co.jp/lifedrinkcompany/zaosoda-500/,506536
14,15,ノースフェイス ベビーコンパクトスリング THE NORTH FACE Baby Compact Sling NMB82150 抱っこ紐 ベビー用品 だっこひも ベビーキャリア 出産準備 アウトドア 【正規品】,22000,"ベビーコンパクトスリングは親子でのファーストアドベンチャーを楽しむための抱っこ紐です。 首の座った時期から使用できる軽量コンパクトな抱っこ紐で、 キャンプなどのアウトドアから普段使いまでをシーンレスにつなげられる機能性を備えています。 抱っこ、おんぶ共に使用できる2WAYスタイルで、子供と過ごす、より新しい冒険の時間を快適に便利に増やしてくれます。 【 SPEC ／製品仕様 】■ブランド名：THE NORTH FACE ■商品名：ベビーコンパクトスリング ■商品型番：NMB82150 ■カラー：ブラック【NMB82150K】,ニュートープグリーン【NMB82150NT】 ■サイズ：— ■素材：75Dポリエステルタフタ ■重量：360g ■生産国：— ■仕様： ・1歳〜3歳を想定した軽量コンパクトな抱っこ紐 ・通気性に優れるメッシュ背面 ・荷重を分散させるショルダーベルト構造 ・ベンチレーション ・日よけカバー内臓ポケット ・撥水素材 ・リフレクター ・洗濯ネットとして使用できるスタッフサックつき ・おんぶ、抱っこで使える2WAY仕様 ・ベビーシェルブランケット（NNB71901）と連結可能■広告文責：株式会社カンパネラ※PCモニター環境により画像の色合いが若干異なる場合がございます。ご了承ください。※当店では、正規のルートから仕入れをおこなった商品を取り扱っております。",https://item.rakuten.co.jp/canpanera/n17-1895/,412209
15,16,【スーパーSALE期間中はエントリーでポイント10倍】ビーレジェンド プロテイン 13種類の味から選べる 2種セット 1kg ×2袋 (2kg)（ホエイプロテイン 女性 男性 ダイエット 筋トレ） おきかえダイエット 筋肥大 be LEGEND,6980,"当店は沖縄・離島・一部地域を除き3,980円(税込)以上で送料無料となります。対象外地域はこちらでご確認くださいビーレジェンドプロテインの単品、栄養成分等はこちらからご確認ください。こちら おいしくて、たんぱく質含有量は1食あたり20g以上。 泡立ちが少なく、溶けが抜群に良いホエイプロテイン。 数あるビーレジェンドのフレーバーの中から、 お好きな2種類をご自由に選んでいただけるセットが新登場！ 定番の組み合わせも良し、意外な組み合わせにするも良しの2袋セットです！※「一杯飲んどコーラ風味」は、コーラ風味を再現するために微炭酸となっております。 水に溶かすことで微量の炭酸ガスが発生し、ふきこぼれる恐れがあるため、 シェイカーに1袋分を入れ、フタをしっかりと抑えてシェイクしてください。 また、シェイカーのフタを開ける際は、ゆっくりとお開けください。 メーカー/輸入元株式会社Realstyle 生産国日本 商品区分健康食品 広告文責株式会社Realstyle 0120-242-007 ■サイトページとパッケージ裏面の栄養成分値の差について■ ビーレジェンドプロテインの原料であるホエイは、ニュージーランドやオーストラリア、アメリカ、ヨーロッパ等の製品を輸入し、国内で製造しております。 その年の天候や乳牛の状態により、ホエイの成分は微妙に変わってきます。そのため、都度より良いホエイ原料選んで仕入れております。 そしてその原料をより美味しく飲んでいただけいるよう日々商品の改良も行っております。 それにより、製造ロットごとに成分値が多少前後してまいります。 随時変更が行われるため、弊社サイトページの成分表の数値と製品裏面の栄養成分表記の記載が合わない可能性があります。 お手元の商品パッケージの裏面の栄養成分表記が正確な数値になりますので、そちらをご確認頂きますようお願いいたします。【重要】アレルギー成分変更のお知らせ 『ビーレジェンド プロテイン すっきリンゴ風味』は、更に美味しくリニューアルいたしました。 なお、リニューアルに伴い本製品に含まれるアレルギー物質が以下の通り変更となります。ご注意ください。 【変更点】 旧　本製品に含まれるアレルギー物質(特定原材料等28品目中) 乳成分・大豆 新　本製品に含まれるアレルギー物質(特定原材料等28品目中) 乳成分・大豆・りんご ご愛飲いただいている皆様にはお礼を申し上げるとともに、リニューアル商品につきましてもご愛顧賜りますよう、よろしくお願い申し上げます。 WPC ホエイ シェイカー シェーカー 減量 筋肉 オススメ おすすめ 低糖質 安い 置き換え 直販 国産 日本製 ランキング 痩せる 人気 運動 ランニング 子供 高齢 3kg 2kg 1kg ドリンク",https://item.rakuten.co.jp/realstyle4u/blco/,567617
16,17,【特典】ポケットモンスター ブリリアントダイヤモンド(マナフィのタマゴ),5920,任天堂 Nintendo Switchポケモン ピカチュウ ポケットモンスター　ブリリアントダイヤモンド 発売日：2021年11月19日 予約締切日：2021年11月17日 HACーPーAX7QA JAN：4902370548983 ゲーム Nintendo Switch RPG オーソドックスRPG マナフィのタマゴ,https://item.rakuten.co.jp/book/16855974/,566404
17,18,【9/22以降順次出荷】アタックZERO 洗濯洗剤 つめかえ用 超特大サイズ 5倍 梱販売用(1800g*6袋入)【アタックZERO】,9362,お店TOP＞日用品＞洗濯用品＞洗濯洗剤＞液体洗剤 衣類用(詰替)＞アタックZERO 洗濯洗剤 つめかえ用 超特大サイズ 5倍 梱販売用 (1800g*6袋入)お一人様5個まで。【アタックZERO 洗濯洗剤 つめかえ用 超特大サイズ 5倍 梱販売用の商品詳細】●超特大つめかえ用5倍※ つめかえ用360g 比●ゼロ洗浄で「落ちにくい汚れ」「生乾き臭」「洗剤残り」ゼロへ。●洗うたび衣類がよみがえる。●アタック液体の洗浄力で、汚れが落ちにくい化学繊維でも高い洗浄力を発揮します。●長時間部屋干し臭を防ぐ。●洗たく槽の防カビも。●すすぎ1回でもOK。●蛍光増白剤無配合。●リーフィブリーズの香り(微香)。【成分】界面活性剤[51％、高級アルコール系(非イオン)、ヒドロキシアルカンスルホン酸塩、脂肪酸系(陰イオン)、高級アルコール系(陰イオン)]、安定化剤、酵素【規格概要】品名：洗濯用合成洗剤用途：綿・麻・合成繊維用液性：中性【注意事項】★使用上の注意・用途外に使わない。・子供の手の届く所に置かない。・認知症の方などの誤飲を防ぐため、置き場所に注意する。・使用後は手を水でよく洗う。・荒れ性の方や長時間使う場合、原液で使う場合は炊事用手袋を使う。・洗たく機のフタなどのプラスチック部分に原液がついた時はすぐに水でふきとる。放置すると傷むことがある。・原液を衣料品に塗布後は、長時間放置しない。★ボトルへのつめかえ方(ご注意)・必ず「アタックZERO」のボトルにつめかえる。・あふれないように、液をほとんど使い切ってからつめかえる。・他の洗剤とまぜると、液が濁ったり、固まることがある。パックを強く持つと、液が飛び出ることがあるので注意する。【原産国】日本【ブランド】アタックZERO【発売元、製造元、輸入元又は販売元】花王商品に関するお問合せ受付時間9：00〜12：00／13：00〜16：00(土曜・日曜・祝日除く)*製品の誤飲・誤食など緊急の場合は、受付時間外でもお電話くださいヘアケア・スキンケア用品：0120-165-692男性化粧品(サクセス)：0120-165-694ニベア・8*4：0120-165-699ソフィーナ・エスト：0120-165-691キュレル：0120-165-698洗たく用洗剤・仕上げ剤・そうじ用品・食器用洗剤：0120-165-693ハミガキ・洗口液・入浴剤・温熱シート：0120-165-696紙おむつ・生理用品・サニーナ：0120-165-695飲料(ヘルシア)：0120-165-697Sonae(そなえ)：0120-824-450ペットケア：0120-165-696リニューアルに伴い、パッケージ・内容等予告なく変更する場合がございます。予めご了承ください。/(/F615601/)/花王103-8210 東京都中央区日本橋茅場町1-14-10 ※お問合せ番号は商品詳細参照広告文責：楽天グループ株式会社電話：050-5577-5043[洗濯洗剤/ブランド：アタックZERO/],https://item.rakuten.co.jp/rakuten24/4901301399304/,210182
18,19,9/4〜9/11 20%オフ！ LED フォグランプ イエロー 10600lm ホワイト 10800Lm 実測値 VELENO ULTIMATE 爆光 ヘッドライト ハイビーム H7 H8 H11 H16 HB3 HB4 PSX24W PSX26W イエローフォグ LEDフォグランプ 1年保証 3000K 車検対応 黄色 【宅配便配送商品】,12797,メーカー希望小売価格はメーカーサイトに基づいて掲載しています商品名 VELENO ULTIMATE LEDフォグランプ 商品説明 すべての方に満足いただける商品を目指して開発した究極のVELENO製品 VELENO ULTIMATELED シリーズ 世界一の明るさを目指したイエローフォグ 待望の白発光も新登場！ 白発光であればヘッドライトのロービーム/ハイビームにも装着可能 驚異の明るさは イエロー発光：実測値10600lm ホワイト発光：実測値10800lm フォグランプ イエロー 2球セット ハイブリット車対応 イエロー発光：3150k（実測値） ホワイト発光：6300k（実測値） 純正バルブと同等のムラのないこだわりの配光 ハイブリッド車対応 静音設計による冷却ファン 優れた防水/防塵性能「IP67」 純正バルブと付け替えるだけの簡単取り付け LEDチップも独自に開発をおこない、チップの配置、明るさ、色にもとことんこだわりました。 LED フォグランプ LEDヘッドライト 【H8/H11/H16適合車種一例】 - アクア - プリウス - アルファード - ヴォクシー/VOXY - エスティマ - ヴィッツ/vits - セレナ - ノート - フィット/fit - オデッセイ - タント - N-BOX - ムーヴ/ムーブ/move ※仕様等により形状が異なる場合がございます。必ず現車にてご確認下さい。 ※イエローにHB3形状はございません。イエロー発光のHB3/HB4をご選択いただきました場合、HB4でのお届けとなります。 適合形状 H8/H11/H16/HB3/HB4/PSX24W/PSX26W 仕様 フォグランプ/ロービーム/ハイビーム 消費電力 イエロー：43W ホワイト：55W 明るさ イエロー：実測値10600lm ホワイト：実測値10800lm 発光色 イエロー発光：3150k（実測値） ホワイト発光：6300k（実測値） 電源 12V車専用 セット内容 2球セット 注意事項 ・こちらの商品は宅配便での発送となります。 時間指定、代引きをご利用の際はこちらからご確認ください。 ・取り付けに関するサポートはできません。 ・整備工場での取り付けを推奨しております。 ・取付に際し加工が必要になる車両もあります。 ・取付の際にバルブに触れたり、バルブを接触させたりしないでください。寿命低下・破損の原因となります。 ・購入後の適合違いによるクレーム、キャンセルは一切受ける事ができませんので十分ご確認の上、ご購入下さい。 ・当商品が起因する損害で工賃おそびその他損害等は保障できませんのでご了承下さい。,https://item.rakuten.co.jp/auc-reiztrading/f022/,209941
19,20,クリスタルガイザー 水 500ml 48本 送料無料 飲料水 ミネラルウォーター 水 お水 天然水 48本入り 24本入り×2ケースセット CRYSTAL GEYSER 500ml×48本【並行輸入品】【D】【代引き不可】【割振】,2440,"※こちらの商品は代引き不可となっております。予めご了承ください。 ※北海道地域へお届けの場合、1個当たり660円の送料を頂戴いたします。 (例：1個ご注文→送料660円) (例：2個ご注文→送料1,320円) ※注文数量によっては別途配送料が発生する場合がございます。配送料がかかる場合につきましては別途ご案内させて頂きます。 ※15ケース以上のご注文の場合、一括納品ができない場合がございます。 また、別途配送料が発生する場合がございます。配送料につきましては別途ご案内させて頂きます。 ※お届け先のエレベーター有無、道幅が狭い場所、配達が困難な場所等、配送業者の判断によっては別途配送料が発生する場合がございます。上記ご了承のうえ、ご注文頂きますようお願い申し上げます。 毎日飲みたいピュアで美味しい軟水 クリスタルガイザーとはアメリカで最も美しい山の1つに数えられるカリフォルニア州の山々を水源とするアメリカ生まれの天然水ミネラルウォーターです。 ミネラルウォーター、クリスタルガイザーで水分補給をしましょう。 ※こちらは通常のミネラルウォーターです。炭酸は含まれておりません。 ※並行輸入品のためキャップの色は白になります。 ※マウントシャスタまたはオランチャの湧水を使用していますがご指定はいただけません。 ※こちらの商品は、輸入の都度予告無くパッケージデザインが変更になる場合がございます。そのため商品画像と実物のデザインが異なる場合がございます。パッケージを理由とした返品・交換は承れません。 ●内容量：500mL×24本 ●(mg／L)エネルギー・・・0 タンパク質・・・0 脂質・・・0 炭水化物・・・0 ナトリウム・・・0 カルシウム・・・18 マグネシウム・・・1.3 カリウム・・・1.7 PH値・・・6.8 ・本品は並行輸入商品です。 ・高温、直射日光をさけて保存してください。 ・開栓後は冷蔵庫に入れ、お早めにお飲みください。 ・容器のまま、加熱、凍結はしないでください。 広告文責e-net shop株式会社03-6706-4521区分原産国　アメリカ/水（軟水）FAQよくある質問は＞＞こちらをご確認下さい＜＜ ※並行輸入品のためキャップの色は白になります。※マウントシャスタまたはオランチャの湧水を使用していますがご指定はいただけません。 ☆お客様からのレビューも高評価！価格＆納期自信あり(^^)v 【ご一緒にいかがですか？】 見逃し厳禁！随時更新中♪",https://item.rakuten.co.jp/kurashikenkou/9419874/,201351
